"screen_name","name","description","category","X","count"
"Starbucks","Starbucks Coffee","Inspiring and nurturing the human spiritÄîone person, one cup, one neighborhood at a time.","brand",NA,34804
"cnnbrk","CNN Breaking News","Breaking news from reporters and editors on the CNN Digital news team. Now 42M strong. Check @cnn for all things CNN, breaking and more.","news",NA,117577
"mrbrown","mrbrown","mrbrown aka Kinmun Lee, Blogfather of Singapore, satirist, writer, lyricist, traveler, photographer, cyclist, gamer, and podcaster. Papa of Faith, Isaac & Joy.","person",NA,75385
"BBCNews","BBC News (UK)","News, features and analysis (https://t.co/FAlDvMvjw7). World news, follow @BBCWorld. Breaking news, follow @BBCBreaking. Latest sport news @BBCSport","news",NA,45714
"BBCBusiness","BBC Business","Business news from the BBC. This is our official account aimed at a UK audience. For more global BBC business news please follow @BBCWorldBiz.","news",NA,18916
"BBCWorld","BBC News (World)","Where we #LiveTheStory - join us https://t.co/zQYj7l9rp2","news",NA,112071
"CNN","CNN","It's our job to #GoThere and tell the most difficult stories. Come with us!","news",NA,101801
"twitter","Twitter","Your official source for news, updates and tips from Twitter, Inc. Need help? Visit https://t.co/qq1HEzvnrA.","channel",NA,116959
"guardiannews","Guardian news","The latest stories from the @guardian's news desks.","news",NA,24624
"nytimes","The New York Times","Where the conversation begins. Follow for breaking news, special reports, RTs of our journalists and more from https://t.co/YapuoqX0HS.","news",NA,112775
"BarackObama","Barack Obama","This account is run by Organizing for Action staff. Tweets from the President are signed -bo.","person",NA,140835
"TechCrunch","TechCrunch","Breaking technology news, analysis, and opinions from TechCrunch. The number one guide for all things tech.
Got a tip? Let us know tips@techcrunch.com","news",NA,31741
"mashable","Mashable","News, resources, inspiration and fun for the connected generation. Tweets by @mashable staff.","news",NA,34665
"WIRED","WIRED","WIRED is where tomorrow is realized.","channel",NA,30201
"FoxNews","Fox News","America's Strongest Primetime Lineup Anywhere! Follow America's #1 cable news network, delivering you breaking news, insightful analysis, and must-see videos.","news",NA,36892
"SAS","SAS","The largest airline company in Scandinavia, flying to and from Europe, with flights to North America and Asia. Customer service: flysas.com or facebook.com/SAS","airline",NA,24919
"Reuters","Reuters Top News","Top and breaking news, pictures, and videos from Reuters.","news",NA,72546
"nytimestravel","NY Times Travel","Travel news and features from around the world.","travel",NA,27845
"nytimesworld","New York Times World","World news from The New York Times. Follow our editors and correspondents here: http://t.co/dZjTQkxoyM","news",NA,20151
"cnni","CNN International","Breaking news from around the world, plus business, style, travel, sport and entertainment. We #gothere.","news",NA,57500
"firefox","Firefox","go forth and internet freely","brand",NA,18056
"MTV","MTV"," tweets by @kaitiii | snapchat: mtv","channel",NA,24343
"facebook","Facebook","Giving people the power to share and make the world more open and connected.","brand",NA,23456
"Skype","Skype","The latest news and updates from the team at Skype. Follow the link below to discover all the wonderful things Skype has to offer.","brand",NA,30522
"washingtonpost","Washington Post","Tweet-length breaking news, analysis from around the world. Founded in 1877. Follow our journalists on Twitter: https://t.co/VV0UBAMHg8","news",NA,54496
"espn","ESPN","We talk about sports, sports, and well ... sports.","sports",NA,54410
"intel","Intel","Intel news, views & events about global tech innovation. Looking for support? Tweet @IntelSupport","brand",NA,37978
"enews","E! News","Entertainment news from https://t.co/G81dlZzugAÄîwatch weeknights at 7p & 11p for the latest! 
Snapchat: e_news","channel",NA,18463
"Newsweek","Newsweek","Stay relevant. News and analysis on politics, science, technology, and culture.","news",NA,19464
"WSJ","Wall Street Journal","Breaking news and features from the WSJ.","news",NA,68468
"FinancialTimes","Financial Times","Headlines from the FT. Follow us on @FT for news stories, features and updates. Our customer service team is @FTcare.","news",NA,36910
"AJEnglish","Al Jazeera English","Everyone has a story worth hearing. Follow @AJENews for breaking news. Add us on Snapchat: AJENews.","news",NA,20755
"wef","World Economic Forum","The international organization for public private cooperation. Follow us for research, insight and analysis on global issues. Annual Meeting hashtag: #wef","",NA,19514
"BBCBreaking","BBC Breaking News","Breaking news alerts and updates from the BBC. For news, features, analysis follow @BBCWorld (international) or @BBCNews (UK). Latest sport news @BBCSport.","news",NA,111753
"Delta","Delta","Official account of Delta Air Lines. We're listening around the clock, 7 days a week. For a formal response please visit https://t.co/NnsfScRHt1.","airline",NA,83004
"TheEconomist","The Economist","News and analysis with a global perspective.  Subscribe here: https://t.co/FDPVGW00W2","channel",NA,73896
"BreakingNews","Breaking News","Be the first to know when news breaks. Get our free app to unlock more updates, see news near you and customize your alerts...","news",NA,43245
"twitterapi","Twitter API","The Real Twitter API. I tweet about API changes, service issues and happily answer questions about Twitter and our API. Don't get an answer? It's on my website.","other",NA,26709
"JetBlue","JetBlue Airways","Hi, nice to tweet you! Fly with us to 90+ destinations and experience our award-winning service. For concerns that require a response, call or email.","airline",NA,55380
"CNNnews18","News18","Latest news alerts from India","news",NA,19022
"TwitterEng","Twitter Engineering","The official account for Twitter Engineering.","other",NA,18101
"SouthwestAir","Southwest Airlines","We run on #SouthwestHeart. Follow for news & stories about the greatest Employees & Customers in the world. For official concerns please use the link provided.","airline",NA,59104
"SkyNews","Sky News","Stories direct from the @SkyNews newsroom. Tweet us your queries and questions. For breaking news, follow @SkyNewsBreak.","news",NA,26242
"UEFAcom","UEFA.com","http://t.co/jtKr33tmy8 - The official website for European football. Bringing you the latest from across Europe.","sports",NA,19155
"richardbranson","Richard Branson","Tie-loathing adventurer, philanthropist & troublemaker, who believes in turning ideas into reality. Otherwise known as Dr Yes at @virgin!","person",NA,54348
"BA_USA","British Airways N.A.","This account is no longer active. Please follow @british_airways for 24-hour a day customer support and updates.","airline",NA,20174
"StateDept","Department of State","Welcome to the official U.S. Department of State Twitter account!  
Secretary Kerry tweets from @JohnKerry.","other",NA,20504
"latimestravel","L.A. Times Travel","@LATimes Travel news and more from Chris Reynolds (@mrcsreynolds), Catharine Hamm (@CatHamm), @AHarnagel (Anne Harnagel) and Brady MacDonald @latimesfunland)","news",NA,17791
"YouTube","YouTube","lol watch this","channel",NA,114446
"PlayStation","PlayStation","Official Twitter updates on PlayStation, PS4, PS VR, PS3, PS Vita, and PSN. Titles rated E-M. Support channel: @AskPlayStation","brand",NA,25386
"timestravel","The Times Travel","The latest travel news, deals and videos plus inspiration for your next trip","travel",NA,19875
"NASA","NASA","Explore the universe and discover our home planet with @NASA. We usually post in EDT (UTC-4).","other",NA,65848
"NBCNewsTravel","NBC News Travel","Getting there is half the fun, so the saying goes. Read about top travel news, issues of the day and the joy and hassle of traveling.","news",NA,18014
"VirginAmerica","Virgin America","Welcome to the only mood-lit Twitter feed. Check out our blog http://t.co/rYssSyFrNc. For official complaints please visit us at http://t.co/cftZiNWDrG. Cheers!","airline",NA,52472
"luxury__travel","A Luxury Travel Blog","Blogging on all things luxury travel at http://t.co/qClm5pokjd - please contact us via the blog ( http://t.co/ItuVWGd0i7 )","travel",NA,24142
"AlaskaAir","Alaska Airlines","Official account of Alaska Airlines. Our Social Care team is here for you 24/7. For a formal response: https://t.co/NejvhDF05N. Tag photos with #iFlyAlaska","airline",NA,26889
"UN","United Nations","Official twitter account of #UnitedNations. Get latest information on the #UNGA. Follow us on Snapchat: united-nations. #GlobalGoals #UN4RefugeesMigrants","other",NA,52841
"NBCNews","NBC News","A leading source of global news and information for more than 75 years. 
 
Facebook: https://t.co/oeDi7xACU7 

Snapchat: https://t.co/suOkoNb0KE","news",NA,33752
"Number10gov","UK Prime Minister","Official channel for Prime Minister Theresa May's office, based at 10 Downing Street. Tweets before 5pm, 13 July 2016 are from the previous Prime Minister.","person",NA,21875
"ladygaga","JOANNE","Perfect Illusion OUT NOW / New Album JOANNE OCT 21 PRE-ORDER: https://t.co/8QsYawBg3M So #JOANNE is like, you know, Lady Gaga if you erase all the fame.","person",NA,69193
"TIME","TIME","Breaking news and current events from around the globe. Hosted by TIME staff. Tweet questions to our customer service team @TIMEmag_Service.","news",NA,68233
"travelchannel","Travel Channel","The official Twitter account of Travel Channel (US). Follow us to talk about all things travel!","travel",NA,35641
"hm","H&M","Welcome to H&M's official Twitter account. For customer service, please tweet @hm_custserv or visit https://t.co/pDnuki6akQ.","brand",NA,21626
"WHO","WHO","Official Twitter account of the World Health Organization, the United Nations' health agency","other",NA,24196
"HuffingtonPost","Huffington Post","internet lovers | sleep believers | news addicts | big font obsessives | greek yogurt fans | Sign our petition to end food waste: https://t.co/kRV9KPguV7","news",NA,40429
"qatarairways","Qatar Airways","Official account of Qatar Airways. Follow us for offers, news, and careers. For Customer Care, please visit https://t.co/nNuqO4z99F","airline",NA,173895
"NewYorker","The New Yorker","The New Yorker is a weekly magazine with a mix of reporting on politics and culture, humor and cartoons, fiction and poetry, and reviews and criticism.","channel",NA,30645
"hrw","Human Rights Watch","We provide timely information on #humanrights crises in 90+ countries. Curated by @jimmurphysf, @astroehlein & @snorthfield45 Staff list https://t.co/wBw0SILvlQ","other",NA,25298
"HarvardBiz","Harvard Biz Review","The leading destination for smart management thinking. Click here to subscribe: https://t.co/7mnPc2GE4Q","channel",NA,23022
"SteveMartinToGo","Steve Martin","My new comedy play, Meteor Shower, is soon to open at the Long Wharf Theatre in Connecticut.","person",NA,17579
"realmadrid","Real Madrid C. F.","Cuenta oficial del Real Madrid C.F., ENGLISH @realmadriden, FRAN√áAIS @realmadridfra, ÿßŸÑÿπÿ±ÿ®ŸäŸá @realmadridarab, Êó•Êú¨Ë™û @realmadridjapan.","sports",NA,27604
"jetairways","Jet Airways","The official Twitter account of Jet Airways. Follow us for interesting updates and information!","airline",NA,23996
"blakeshelton","Blake Shelton","The Official Blake Shelton Twitter. You're getting the real BS straight from Blake himself. (And a few official updates from Team BS too)","person",NA,27850
"CBSNews","CBS News","The official twitter feed of @CBSNews. Follow for original reporting and trusted news.","news",NA,29698
"lonelyplanet","Lonely Planet","Tweeting + retweeting the best in travel: in-depth articles, inspiring photography, intrepid videos. #lp | For the latest daily travel news see @lptravelnews","travel",NA,54248
"ReutersBiz","Reuters Business","Top business news around the world. Join us @Reuters, @breakingviews, @ReutersGMF","news",NA,21888
"andersoncooper","Anderson Cooper","tweets by Anderson Cooper. Anchor of @AC360 on CNN and correspondent on @60Minutes. Author of NYTimes Best Seller - The Rainbow Comes And Goes","person",NA,21694
"ParamountPics","Paramount Pictures","Welcome to the Official Twitter Page for Paramount Pictures.","",NA,17619
"VirginAustralia","Virgin Australia","Welcome to the official page for Virgin Australia. We're here to help from 5am-11pm (AEST). For 24/7 assistance call 13 67 89. Feedback: http://t.co/bpg9Lb8EOj","airline",NA,70204
"Airbus","Airbus","A global team designing, manufacturing and supporting the world's leading aircraft... with passengers at heart and airlines in mind.","travel",NA,53650
"stephenfry","Stephen Fry","Actor and writer currently working on new TV comedy @GreatIndoorsCBS Instagram - stephenfryactually","person",NA,23953
"jimmyfallon","jimmy fallon","astrophysicist","person",NA,57193
"TEDTalks","TED Talks","The official feed for http://t.co/XyGsGk6F0m. Ideas worth spreading.","channel",NA,32897
"WestJet","WestJet","Welcome to the official WestJet Twitter account! We're online and available to help 24/7. Please send personal info via direct message only.","airline",NA,25733
"IPL","IndianPremierLeague","Follow to get exclusive and real-time Indian Premier League news and updates.","sports",NA,17619
"Windows","Windows","Windows news, product info & global stories of people using Windows technology to #DoGreatThings. For support tweet @WindowsSupport","brand",NA,40693
"USATODAY","USA TODAY","The latest news and most interesting stories from USA TODAY. News that's meant to be shared.","news",NA,25669
"TheEllenShow","Ellen DeGeneres","Comedian, talk show host and ice road trucker. My tweets are real, and they're spectacular. https://t.co/rJNCGU9GhH","person",NA,106806
"fodorstravel","Fodor's Travel","Travel Intelligence to give you insightful observations and recommendations to plan your next getaway.","travel",NA,21490
"amnesty","AmnestyInternational","We've been fighting the bad guys since 1961 - you can join us! Official Amnesty International USA profile - RTsâ†endorsements.","other",NA,18409
"CNNMoney","CNNMoney","The money news that matters most to you. Meet our team: http://t.co/krbacc9dFn","channel",NA,20789
"RyanSeacrest","Ryan Seacrest","The day will happen whether or not you get up. - John Ciardi","person",NA,21907
"VictoriasSecret","Victoria's Secret","Welcome to the official feed for Victoria's Secret, where Angels, Bombshells & the sexiest followers on Twitter get their fix for everything VS.","brand",NA,22099
"TravelLeisure","Travel + Leisure","Your connection to the world of travel, brought to you by our editors. Questions? Stories? Please share! Social media terms: http://t.co/EZJig77Mz1","travel",NA,37288
"StephenAtHome","Stephen Colbert","Vehicle","person",NA,24648
"Telegraph","The Telegraph","The latest news, business, sport, comment, lifestyle and culture from the https://t.co/cJ9Ctg93KL team.","news",NA,19645
"TripAdvisor","TripAdvisor","Know better, book better and go better on the world's largest travel site.","travel",NA,49960
"britneyspears","Britney Spears","My new album #Glory is out now!","person",NA,56927
"Lumia","Lumia","The official destination for the latest news, updates and insights from the Microsoft Lumia team. For support Tweet @LumiaHelp","brand",NA,23188
"ESPNcricinfo","ESPNcricinfo","The home of cricket. https://t.co/tBXKmUsRs1
https://t.co/SehLbGwWnT","sports",NA,19473
"9GAG","9GAG","Officially 9GAG. Follow us for LOL. get our app on http://t.co/nCs4SurI1w","channel",NA,58000
"Iberia","Iberia","A tu servicio 24 horas los 365 dias del ano. øEn que podemos ayudarte desde aqui? °Te leemos! :)","airline",NA,21480
"latimes","Los Angeles Times","News from Los Angeles and the world. Staffed by http://t.co/zb8HyvYyAJ editors.","news",NA,21058
"cathaypacific","Cathay Pacific","Welcome to the Cathay Pacific Airways Twitter community, where you can share your #lifewelltravelled moments!  You'll find us tweeting Mon-Fri between 9am & 5pm","airline",NA,124860
"Independent","The Independent","News, comment and features from The Independent.","news",NA,20666
"AsianaAirlines","Asiana Airlines","Official Twitter of Asiana Airlines USA. Main hub: Seoul, Korea. #ASIANA380 now operating LAX-ICN via OZ202/201. Formal responses visit http://t.co/VzCObfDbdR","airline",NA,44991
"hootsuite","Hootsuite","Social media news and tips from the world's most widely used social relationship platform. Sign up for free: http://t.co/Zmrb0hY23s Support: @Hootsuite_Help","news",NA,34567
"CNTraveler","Conde Nast Traveler","At home in the world. 

Snapchat: CNTraveler","travel",NA,30148
"Expedia","Expedia","Travel tips, inspiration & deals from https://t.co/fcT976R6Hd. Customer service from 5am-10pm PT daily. Have you checked out the Expedia Viewfinder blog yet?","travel",NA,21854
"NatGeo","National Geographic","Since 1888, we've traveled the Earth, sharing its amazing stories with new generations. Official Twitter account of National Geographic.","channel",NA,70479
"Discovery","Discovery","Grab life by the globe!","channel",NA,24676
"Support","Twitter Support","We Tweet tips and tricks to help you boost your Twitter skills and keep your account secure. For detailed help, visit http://t.co/qq1HEzdMA2.","",NA,31616
"taylorswift13","Taylor Swift","Born in 1989.","person",NA,93468
"tonyfernandes","Tony Fernandes","GCEO of AirAsia, Founder of Tune Group, Chairman of QPR , Chairman of Caterham Group.","person",NA,18194
"AviationWeek","Aviation Week","Insight and analysis from the Aviation Week Network, the largest information provider to the global aviation, aerospace and defense industries since 1916.","travel",NA,18440
"British_Airways","British Airways","Official British Airways Twitter account. We love reading your Tweets & are here 24 hours a day, 7 days a week to help. You can also visit","airline",NA,138745
"KenyaAirways","Kenya  Airways","The Pride of Africa.Official KQ page sharing news, views and overall experience. E-mail: Customer.Relations@kenya-airways.com Tel:+254711024747/+254734104747","news",NA,19617
"CalvinHarris","Calvin Harris","Music producer","person",NA,18903
"CalvinKlein","Calvin Klein","Calvin Klein is a global lifestyle brand that exemplifies bold, progressive ideals and a seductive, and often minimal, aesthetic.","brand",NA,20830
"jamieoliver","Jamie Oliver","Official Jamie Oliver: Proud Dad & Chef","person",NA,24455
"priyankachopra","PRIYANKA","Dreamer.. Achiever..","person",NA,42031
"narendramodi","Narendra Modi","Prime Minister of India","person",NA,50550
"coldplay","Coldplay","New album, A Head Full Of Dreams, out now worldwide. #AHFODtour runs through 2016. Spanish language account: @coldplay_es","person",NA,28400
"TurkishAirlines","Turkish Airlines","Thanks for visiting Europe's Best Airline on Twitter! Follow us for insights into our destinations and much more. Got an enquiry? Please consult @TK_HelpDesk.","airline",NA,110831
"FT","Financial Times","News stories, features and updates from the FT. For headlines follow @financialtimes. Our customer service team is @FTcare.","news",NA,29672
"aplusk","ashton kutcher","I make stuff, actually I make up stuff, stories mostly, collaborations of thoughts, dreams, and actions. Thats me.","person",NA,25541
"MAS","Malaysia Airlines","Welcome to the official Malaysia Airlines Berhad Twitter account. We're tweeting here Monday to Friday 10am-5pm Malaysia time (GMT +8)","airline",NA,102665
"TravelMagazine","The Travel Magazine"," Get the latest travel news, articles, reports, guides, offers, competitions and more from https://t.co/0In5ml7F8A - we'd love to hear from you too.","travel",NA,31818
"SkySports","Sky Sports ","The official Sky Sports Twitter account. Bringing you the latest sports news, 24-7.","sports",NA,18965
"MariahCarey","Mariah Carey","New album #1toInfinity out now!","person",NA,22141
"JetstarAirways","Jetstar Airways","Australia's all day, every day low fares airline. Here to help with customer service queries & fantastic offers. Monitored 7am-8pm weekdays & 9am-5pm weekends.","airline",NA,52562
"Oprah","Oprah Winfrey","","person",NA,64078
"Entrepreneur","Entrepreneur","Inspiring, informing and celebrating entrepreneurs since 1973. Please tweet @EntCommunity for questions and event live-feeds.","channel",NA,21528
"NFL","NFL","Official Twitter account of the National Football League. Our Social Media Policy: https://t.co/Og68FW2cN7","sports",NA,31080
"rustyrockets","Russell Brand","x2 new gigs announced London and Hayes! tickets are here: https://t.co/kcYt4hkDE0","",NA,18580
"LFC","Liverpool FC","Official worldwide account of Liverpool FC, England's most successful club with 41 major honours #LFC","sports",NA,21416
"FlyAirNZ","Air New ZealandÔ∏è","The official Air New Zealand Twitter account  We're listening 24/7. Please call 0800 737 000 for immediate assistance.","airline",NA,69070
"arrahman","A.R.Rahman","Grammy and Academy Award winning musician","person",NA,37131
"IndiaToday","India Today","Brings you news breaks:Exclusive political, entertainment, sports insight, unbiased-nonaligned


Follow us @IndiaToday

Official URL: http://t.co/ICyUpGKpTg","news",NA,20393
"NBA","NBA","30 teams, 1 goal. #ThisIsWhyWePlay","sports",NA,38715
"BDUTT","barkha dutt","Barkha Rani JamKe Barasti Hai. Cloudburst. Journalist. Dreams of being a Lawyer. Argumentative! Yaaron Ka Yaar.","person",NA,21115
"rickygervais","Ricky Gervais","Godless Ape. Comedian, Actor, Screenwriter, Movie Director. #TheOffice #Extras #Derek #TheRickyGervaisShow #LifeOnTheRoad #Humanity","person",NA,20581
"JoannePeh","Joanne Peh","Actress, Singapore. Loves art, music, literature & fashion.","person",NA,31888
"ELLEmagazine","ELLE Magazine (US)","ELLE-o. It's me.","channel",NA,17502
"wizkhalifa","Wiz Khalifa","Taylor Gang","person",NA,33135
"CNBC","CNBC","First in Business Worldwide","news",NA,20469
"google","Google","News and updates from Google","channel",NA,65221
"businessinsider","Business Insider","What you need to know.","channel",NA,21230
"DalaiLama","Dalai Lama","Welcome to the official twitter page of the Office of His Holiness the 14th Dalai Lama.","person",NA,43895
"VirginAtlantic","Virgin Atlantic","Hello Gorgeous! Follow us for news, banter & assistance 24/7. Visit our blog at https://t.co/ziOX3LRnnS or for official concerns visit https://t.co/ZQJmKUNzyR","airline",NA,85526
"UNESCO","UNESCO","Building peace where it starts - in the minds of men & women. Follow our Director-General @IrinaBokova","other",NA,17437
"the_hindu","The Hindu","News feeds from India's National Newspaper","news",NA,18010
"amazon","Amazon","Official Twitter of http://t.co/4rwjfdidk3.  Contact @AmazonHelp for customer support.","brand",NA,17626
"HeathrowAirport","Heathrow Airport","Welcome to the official Heathrow Airport Twitter feed. We're here to help every day between 6:30am and 11pm (GMT). Follow @yourHeathrow for our expansion news.","airport",NA,47418
"ddlovato","Demi Lovato","","person",NA,43183
"allkpop","allkpop","breaking kpop celebrity news and gossip!","channel",NA,41217
"staralliance","Star Alliance","The Star Alliance network provides a range of benefits for the international traveller to improve their travel experience, wherever they are in the world.","airline",NA,72875
"UberSoc","UberSocial","A full-featured, customizable Twitter app just for you. For support, please submit tickets here: http://t.co/PBWcqQ73","other",NA,23268
"katyperry","KATY PERRY","Rising...","person",NA,99152
"Icelandair","Icelandair","Welcome to the official Twitter of Icelandair. Icelandair is an international airline currently serving 40 gateways in Europe, the USA and Canada.","airline",NA,18238
"FlySWISS","Swiss Intl Air Lines","Official twitter account of Switzerland's national airline. SWISS in CH @FlySWISS_CH, in the USA @FlySWISS_US, SWISS Cargo @SwissWorldCargo","airline",NA,45950
"Australia","Australia","Tourism Australia's official account. We're also @Australia on Instagram.","other",NA,21845
"GuardianTravel","Guardian Travel","The latest travel news, insider guides, emerging destinations, new hotels and travel trends from the @Guardian. Instagram: guardiantravelsnaps","travel",NA,23792
"BoeingAirplanes","Boeing Airplanes","Official Twitter of Boeing Commercial Airplanes - 
We design, build and support a family of technologically advanced commercial jets","travel",NA,44785
"AmericanAir","American Airlines","We're here to offer advice and inspiration for your trip on American. Please click here if you require a formal response to a complaint:https://t.co/gHXQN4ORDA","airline",NA,95268
"ChelseaFC","Chelsea FC","Welcome to the official Twitter account of Chelsea Football Club.","sports",NA,22485
"AirAsia","AirAsia","Welcome to our official Twitter account where we tweet exclusive updates, contests & our low fares all in just 140 characters!","airline",NA,118430
"KingJames","LeBron James","EST. AKRON - ST.V/M Class of '03  http://t.co/IneJylUd1m #IPROMISE","person",NA,42113
"KevinHart4real","Kevin Hart","My name is Kevin Hart and I WORK HARD!!! That pretty much sums me up!!! Everybody Wants To Be Famous But Nobody Wants To Do The Work","",NA,34917
"selenagomez","Selena Gomez","#REVIVAL out NOW. https://t.co/zP4EExdSBG Get The Revival Tour Line: https://t.co/YHbGeHnygg","person",NA,59602
"KoreanAir_KE","Korean Air","Leading Global carrier, a founding member of SkyTeam, operates more than 400 flights per day to 131 cities in 46 countries.","airline",NA,58276
"KrisJenner","Kris Jenner","MOM, MANAGER, MOMAGER, LOVER OF LIFE, LOVER OF CHRIST","person",NA,17780
