"screen_name","name","description","category","X","count"
"kourtneykardash","Kourtney Kardashian","Heartless","person",NA,38844
"davidguetta","David Guetta","Official David Guetta Twitter Page. http://t.co/RMCqdEM9XC","person",NA,27820
"usatodaytravel","USA TODAY Travel","Get the latest travel news, deals and trends about flights, hotels, cruises and destinations from the USA TODAY Travel team.","travel",NA,20256
"ShashiTharoor","Shashi Tharoor","MP for Thiruvananthapuram. Author of 15 books. Former Minister of State,Govt.of India.  Former UnderSecretaryGeneral,UnitedNations. RTs do not imply endorsement","person",NA,18992
"nokia","Nokia","Are you ready for a new era of technology? Join us in expanding the human possibilities of the connected world.","brand",NA,23277
"Xbox","Xbox","Welcome to the official @Xbox Twitter feed, your source for news, console info, game releases, events, sports, & more. For help, please contact @XboxSupport.","brand",NA,21285
"maroon5","Maroon 5","This is the Official Twitter page for Maroon 5
@adamlevine @jamesbvalentine @JRCarmichael and @pjmorton. #V out now! http://t.co/pqyCrYEX2h","person",NA,26450
"ParisHilton","Paris Hilton","My new fragrance #GoldRush is now available  https://t.co/Or93I1Mxuu","person",NA,24840
"FortuneMagazine","Fortune","FORTUNE's official Twitter feed. Here's what we're hearing, seeing, reading and writing. Visit us at http://t.co/EZnUYxNm","channel",NA,20243
"realDonaldTrump","Donald J. Trump","","person",NA,33107
"Boeing","The Boeing Company","Boeing has a tradition of aerospace leadership and innovation, and is committed to investing in the communities where our people work and live worldwide.","travel",NA,40284
"Lufthansa_DE","Deutsche Lufthansa","Das ist der offizielle Lufthansa_DE Twitter-Kanal. Bitte richtet Anregungen, Lob oder Kritik an: https://t.co/GjRy7UfyzU","airline",NA,24220
"KimKardashian","Kim Kardashian West","","person",NA,65991
"JJ_Lin","JJ Lin","Born & bred in Singapore, currently residing in Taiwan. We are all placed on earth to leave imprints on each others' lives.","",NA,19479
"danieltosh","daniel tosh","not a doctor","person",NA,29057
"QantasUSA","Qantas Airways USA","Official Qantas USA. Follow us for USA news & fare sales. Visit https://t.co/2rwl9Mp5h8. For travel q's you may contact @Qantas. We're here Mon-Fri 9am-5pm PST.","airline",NA,33791
"airberlin","airberlin","A warm welcome to the official airberlin Twitter account. Discover the world of airberlin and register now for the airberlin newsletter! https://t.co/tmcNONhGio","airline",NA,19362
"MercedesAMGF1","MERCEDES AMG F1","The official Twitter account of the MERCEDES AMG PETRONAS Formula One Team - 2014 and 2015 Formula One World Champions!","other",NA,20501
"muttons","MuttonsInTheMorning","Muttons In The Morning - Weekdays 6am-10am on Class95FM. Radio geeks. Loves 4-ply tissue.","channel",NA,27621
"SportsCenter","SportsCenter","All things sports. Nominate top plays using #SCtop10. *If you tweet or otherwise send us content, you consent to ESPN using and showcasing it in any media.*","sports",NA,44057
"jtimberlake","Justin Timberlake","","person",NA,73059
"STATravelSG","STA Travel Singapore","The Singapore office of the world's largest (& coolest!) travel company for students and young adults. Like us on Facebook @ http://t.co/e0Otptwr6W!","travel",NA,19489
"RealHughJackman","Hugh Jackman","Instagram: @TheHughJackman","person",NA,24732
"IATA","IATA","The International Air Transport Association (IATA) is the global trade association of airlines. Our 260 members comprise 83% of total air traffic.","travel",NA,30933
"Drake","Drizzy","Views From The 6","person",NA,38229
"justinbieber","Justin Bieber","Let's make the world better. Join @bkstg and add me on @shots 'justinbieber'. COLD WATER and LET ME LOVE YOU out now. OUR new album PURPOSE out NOW","person",NA,77193
"Zoella","Zo√´","YouTuber, Blogger, Friend & Pizza Addict ","person",NA,25178
"Audi","Audi","The official Twitter account of Audi of America.","brand",NA,24951
"987fm","987","ABOVE THE NOISE. Tweets by @987Sonia / @987Kimberly / @TabithaNauser / @BoyThunder987 / @JoakimGomez","channel",NA,56992
"WorldBank","World Bank","The official World Bank Twitter feed. The World Bank's mission is to fight poverty with passion and professionalism for lasting results.","other",NA,27497
"KAYAK","KAYAK","KAYAK is a travel search engine. For support, visit: http://t.co/dITnoI8o4D (staff available Mon- Fri: 8AM GMT-10PM GMT)","travel",NA,17744
"Pink","P!nk","it's all happening","person",NA,34768
"ABC","ABC News","See the whole picture with @ABC News. Join us on Facebook: https://t.co/ewMNZ54axm","news",NA,38810
"Xiaxue","Äø Xiaxue ÂΩ°","Bitching now comes in bite-sized pieces","person",NA,65880
"WhiteHouse","The White House","Follow for the latest from President Obama and his Administration. For tweets from the President, follow @POTUS. Tweets may be archived: https://t.co/eVVzoBb3Zr","other",NA,50157
"AirFranceUS","Air France US","#FranceisintheAir! At your service 24/7. Stay connected for our latest news. For media inquiries tweet @AFNewsroom (Personal info by DM only)","airline",NA,19081
"GEAviation","GE Aviation","GE Aviation provides jet and turboprop engines, integrated systems and services for commercial, military and business & general aviation aircraft.","brand",NA,18061
"googlemaps","Google Maps","Photographic dispatches from Planet Earth.","brand",NA,29231
"akshaykumar","Akshay Kumar","","person",NA,38326
"pitbull","Pitbull","Mr. Worldwide. Musician. Entertainer. Entrepreneur.","person",NA,26659
"EconBizFin","The Economist","Official posts from The Economist on Business, Finance and Economics. Subscribe to our Money Talks podcast here https://t.co/3cTKbmDJha","",NA,22878
"LondonCityAir","London City Airport","London City Airport - the true gateway to London","airport",NA,18074
"googledrive","Google Drive","Google Drive is a safe place for all your files. Use Drive for free on all your devices. Visit http://t.co/ReoUx29Gxc to get started.","brand",NA,19542
"khloekardashian","Khloe","Get my official app #unlockmyworld https://t.co/t7gWBbUMY7","",NA,38472
"mtvasia","MTV Asia","Official MTV Asia Twitter Site","",NA,17452
"ParineetiChopra","Parineeti Chopra","Instagram - Parineetichopra. Snapchat - ChopraParineeti","person",NA,31275
"shrutihaasan","shruti haasan","everything in its right place","person",NA,22640
"Gatwick_Airport","Gatwick Airport LGW","We're here 24/7 to answer your questions and help you have a great experience at Gatwick. Follow @LGWobviously for runway 2 news.","airport",NA,27993
"UNICEF","UNICEF","UNICEF promotes the rights and wellbeing of every child in 190 countries and territories, with a special focus on reaching those in greatest need.","other",NA,37562
"anandmahindra","anand mahindra","Chairman and Managing Director, Mahindra Group","person",NA,19858
"Sony","Sony","The official Twitter account for Sony in the United States.","brand",NA,26049
"ArianaGrande","Ariana Grande","dangerous woman","person",NA,55801
"thenewpaper","The New Paper","Local. Vocal. Social. Also check out @TNPSports and @TNP__M","news",NA,65398
"leehsienloong","Lee Hsien Loong","Prime Minister of Singapore, and leader of @PAPSingapore. This account is maintained by the Prime Minister's Office. Tweets by Mr Lee are signed LHL.","person",NA,78097
"Arsenal","Arsenal FC","The official club website brings you all the latest #Arsenal news, views and ticket information from Emirates Stadium

Follow:
@OfficialAFC_ID
@OfficialAFC_ES","sports",NA,24378
"business","Bloomberg","The first word in business news.","news",NA,35132
"HawaiianAir","Hawaiian Airlines","Your source for Hawaiian Airlines news, tips, & updates. For customer issues, please contact us at: https://t.co/ZsM44LNYPV","travel",NA,20840
"aliciakeys","Alicia Keys","Passionate about my work, in love with my family and dedicated to spreading light. It's contagious! ;-) https://t.co/vZcUuNOKcz","person",NA,27351
"KDTrey5","Kevin Durant","IM ME, I DO ME, AND I CHILL","person",NA,24231
"cntraveller","Conde Nast Traveller","Travel inspiration from the editors of Conde Nast Traveller UK","travel",NA,19844
"NatGeoTravel","NatGeoTravel","Your guide to traveling with passion and purpose","travel",NA,41544
"htTweets","Hindustan Times","One of India's largest media companies. Latest news from around the world. Retweets are not endorsements.","news",NA,22186
"ndtv","NDTV","Breaking news alerts from India","news",NA,29577
"cathaypacificUS","Cathay Pacific US","Greetings! This Twitter page is managed by Nancy in San Francisco, M-F, 9am-5pm.","",NA,25299
"STcom","The Straits Times","Breaking news from the online site of Singapore's most widely read newspaper","news",NA,96426
"stompsingapore","Stomp Singapore","Award-winning Stomp is Asia's leading citizen journalism website with user-generated material fuelling its success. @stompsingapore on Instagram","news",NA,59788
"SingaporePolice","SingaporePoliceForce","Welcome to Singapore Police Force's official Twitter account. Pls do NOT report crimes here. Call 999 instead. To provide info, pls call 18002550000. Thank you.","other",NA,53724
"ChannelNewsAsia","Channel NewsAsia","The official space of Channel NewsAsia - the source of breaking news from Asia & the world. We want to hear from you. Comments and news tips are welcome.","news",NA,93862
"IndianExpress","The Indian Express","The Indian Express brings to you latest news from India and the world, breaking round the clock. The 'Journalism of Courage' starts here.","news",NA,19094
"easyJet","easyJet","Connecting people across Europe & passionate about making travel easy & affordable. 8:00-8:00pm GMT Mon-Sun. For customer services visit
https://t.co/hOTXBHTSHz","travel",NA,40633
"gmail","Gmail","News, tips and tricks from the Gmail team. Need help? Fly on over to our Help Center or forum.","brand",NA,36458
"airliners_net","Airliners.net","The Best Aviation Photos, Largest Online Aviation Community, Airplane Information and Aviation News!","travel",NA,19463
"AirlineReporter","Airline Reporter","Providing engaging news & stories on aviation, travel, & airlines since 2008. Over 30 writers, in 18 cities, on 4 continents. Home of the #AvGeek!","travel",NA,18554
"AirFranceFR","Air France FR","#FranceisintheAir ! @AirFranceFR vous delivre ici ses dernieres offres et est √† votre service 24/7. (Donnees perso uniquement en DM)","airline",NA,19789
"TODAYonline","TODAY","Get the latest local and international news from TODAYonline, Singapore's most popular compact newspaper. Also on iOS and Android: https://t.co/hAu0nhk4YE","news",NA,84966
"agnezmo","AGNEZ MO","DREAM BELIEVE & MAKE IT HAPPEN! Instagram: @agnezmo and @myfitnezdiary Tumblr: https://t.co/Gr7UE5iP2x Facebook: https://t.co/gKjuCm59Q7","person",NA,18951
"TheRealRyanHiga","Ryan Higa","That asian on youtube #higaholics New #TEEHEE app here: iPhone: http://t.co/YJn1KuC9bQ Android: http://t.co/0LokdFMnO6","person",NA,34102
"LouisVuitton","Louis Vuitton","The official Twitter page for Louis Vuitton Worldwide. Contact client services at @LVServices for customer assistance and personalised advice.","brand",NA,31437
"elonmusk","Elon Musk","Tesla, SpaceX, SolarCity, PayPal & OpenAI","person",NA,19101
"HHShkMohd","HH Sheikh Mohammed","Official Tweets by His Highness Sheikh Mohammed bin Rashid Al Maktoum","person",NA,20297
"shakira","Shakira","#LaBicicleta @CarlosVives & Shakira. iTunes: https://t.co/soIQTtdbP9  https://t.co/oEZtqqavxC","person",NA,37653
"chetan_bhagat","Chetan Bhagat","The CB family!","person",NA,25760
"GoogleTravel","Google Travel Team","Google's Travel Team (Official): Here to provide the latest industry news & data","travel",NA,21656
"Lufthansa_USA","Lufthansa USA","Welcome to the official Lufthansa account for the US! https://t.co/bgi9PfSMN3 Request a response: https://t.co/fmhf6rQuR8","airline",NA,39319
"henrygayle","Chris Gayle","Universe-Boss / 'Chris d Lion'","person",NA,21945
"EtihadAirways","Etihad Airways","Welcome to the official Etihad Airways Twitter account! Follow us for latest news, events and exclusive competitions! For queries or problems, go to @EtihadHelp","airline",NA,147133
"radityadika","raditya dika","Seorang pencerita dalam berbagai macam medium: buku, film, dan digital. CP: 081285000335 (Wira)","",NA,17779
"Burberry","Burberry","Shop the show: https://t.co/1F5QFB7Bjc","brand",NA,26484
"RobertDowneyJr","Robert Downey Jr","You know who I am.","person",NA,21918
"iamwill","i.am+","#WHEREStheLOVE August 31st.","person",NA,20510
"tomhanks","Tom Hanks","I'm that actor in some of the movies you liked and some you didn't. Sometimes I'm in pretty good shape, other times I'm not. Hey, you gotta live, you know?","person",NA,30220
"BillGates","Bill Gates","Sharing things I'm learning through my foundation work and other interests...","person",NA,95854
"AP","The Associated Press","News from The Associated Press, and a taste of the great journalism produced by AP members and customers. Managed 24/7 by these editors: http://t.co/BibaTN49vB","news",NA,54171
"sonamakapoor","Sonam Kapoor","a female actor who lives to eat and read in that order.

https://t.co/0xFnHBrZbs","person",NA,33689
"JimCarrey","Jim Carrey","Actor Jim Carrey!","person",NA,21172
"MaheshNBhatt","Mahesh Bhatt","Film Maker, Author, Nomad with no destination. I don't have any thoughts which I can call my own--not one thought, not one word, not one experience.","person",NA,17367
"flyPAL","Philippine Airlines","This is the OFFICIAL twitter site of Philippine Airlines.","airline",NA,18485
"MercedesBenz","Mercedes-Benz","Welcome to Mercedes-Benz - stay informed and follow us. For technical assistance please contact your local dealer. Provider: https://t.co/dIo7vVvhBh","brand",NA,26649
"TigerairSG","TigerairSG","The official Twitter page of Tigerair Singapore","airline",NA,21736
"AnushkaSharma","Anushka Sharma","","person",NA,31175
"AirCanada","Air Canada","News & more. For fare discounts & special offers follow @ACFlightOffers. | Nouvelles et plus. Pour nos offres speciales suivez @ACFlightOffers.","airline",NA,54618
"sardesairajdeep","Rajdeep Sardesai","father first.Journalist, anchor, author: 2014: The Election That Changed India. mail: rajdeepsardesai52@gmail.com. blog at https://t.co/L2nINGl0kb","person",NA,21184
"KLM","Royal Dutch Airlines","Official global account of KLM. While we keep you updated, we're at your service in 12 languages. Share personal details only in private messages!","airline",NA,103517
"googlechrome","Google Chrome","The official Twitter account for the Google Chrome browser, OS, Chromebooks, Chromecast, and Web Store","brand",NA,39342
"shahidkapoor","Shahid Kapoor","Actor, Dreamer, Lover, Believer .","person",NA,31492
"govsingapore","Singapore Government","Gov.sg - the official Twitter account of the Singapore government. Your first stop for the very latest policy announcements, information and news on Singapore.","other",NA,63262
"Porsche","Porsche","The official Twitter handle of Porsche Cars North America. Our Customer Care team is here to help. Tweet #PorscheCares or call 1-800-PORSCHE for assistance.","brand",NA,24093
"NaomiNeo_","Naomi Neo","I've nothing to say, cos you'd judge me anyway. Hate me? Block me. 

Contact business@naomineo.com

https://t.co/7mI9vCCdps","person",NA,56936
"sonunigam","Sonu Nigam","","person",NA,19008
"Metro_TV","METRO TV","The Official Twitter Page of METRO TV | METROTVNEWS com","news",NA,20488
"karanjohar","Karan Johar","Filmmaker....","person",NA,33717
"Riteishd","Riteish Deshmukh","Life is a Drawing Board, Sharpen your pencil, dont forget the eraser.","",NA,24111
"NEAsg","NEA","NEA is the leading public organisation responsible for improving & sustaining a clean & green environment in Singapore. Contact us @ http://t.co/yZ9jceBqoo","other",NA,66758
"PAPSingapore","PAP Singapore","Published by and at the direction of the People's Action Party, 57B New Upper Changi Road, #01-1402, Singapore 463057

Instagram: @papsingapore","other",NA,25118
"KAKA","Kaka","https://t.co/6tgzPaNfFt","person",NA,26274
"BoyThunder987","Gerald Koh","#TheBroCode987 Weekdays 4 - 8pm @987FM geraldkoh@mediacorp.com.sg Snapchat : Geraldkoh987 Instagram: Geraldkoh987","person",NA,21448
"MonsterEnergy","Monster Energy","#UnleashTheBeast https://t.co/qgChRebwPI https://t.co/ul5xeAYPNW 
https://t.co/8TIgfASmRx
https://t.co/onacwQzm8B","",NA,17522
"RT_com","RT","RT, the global news network, broadcasts from Moscow, London and Washington studios to over 100 countries.","news",NA,21653
"ChangiAirport","Changi Airport","The official #ChangiAirport Twitter account for the latest news, events & deals. You may also follow @ChangiAirport on Facebook, Instagram, YouTube & LinkedIn.","airport",NA,22508
"ajaydevgn","Ajay Devgn","strong beliefs win strong men, and then make them stronger. @ShivaayTheFilm","person",NA,25410
"lindsaylohan","Lindsay Lohan","Artist. Instagram: @lindsaylohan https://t.co/FjAZzhd8HY","person",NA,17711
"LaraDutta","Lara Dutta Bhupathi","One head, many hats!   Instagram ac - @larabhupathi","person",NA,18711
"BW","Businessweek","The official Twitter of Bloomberg Businessweek. Covering the business world like no one else.","channel",NA,20721
"toshrock","Tosh Zhang","I'm thankful just to be alive cos everyday's a gift. https://t.co/jK1VqdRh5W For business enquiries: toshroc@gmail.com","person",NA,52739
"ThoughtCatalog","Thought Catalog","All thinking is relevant.","channel",NA,21251
"LTAsg","LTA","Latest transport happenings & lifestyle updates. 

For traffic news, follow @LTATrafficNews. Check out our FB (https://t.co/Ucwpk8rJWH) & IG (@LTAsg) for more!","other",NA,64183
"RanveerOfficial","Ranveer Singh","Living the dream.......","person",NA,22758
"thekiranbedi","Kiran Bedi","LtGov.Puducherry,IPS (retd),Magsaysay Awardee,former UN Police Advisor,Asian Tennis Champ,Law,PhD-IIT,Nehru Fellow,Author,Voted Most Trusted,Admired Woman,2NGOs","person",NA,26650
"F1","Formula 1","The Official Formula 1Æ Twitter Account","other",NA,19518
"detikcom","detikcom","Official Twitter of http://t.co/oOBkZ1EQMA. redaksi@detik.com | promosi@detik.com | 
Android: http://t.co/uBAYnisH9r
iPhone: http://t.co/36uDqdyxKN","news",NA,24034
"UNHumanRights","UN Human Rights","The United Nations #HumanRights office is led by High Commissioner #Zeid","other",NA,21688
"imVkohli","Virat Kohli","The Official twitter account of Virat Kohli, Indian cricketer,gamer,car lover,loves soccer and an enthusiast","person",NA,34765
"Versace","Versace","Founded by Gianni Versace in 1978, Versace is one of the world's leading international fashion brands and is a symbol of Italian style worldwide.","brand",NA,20193
"Jetstar_Asia","Jetstar Asia","Low fares are just part of the story","airline",NA,39642
"AvrilLavigne","Avril Lavigne","Get 'Avril Lavigne' on iTunes now: https://t.co/m8yd5aoLeN","person",NA,27068
"Microsoft","Microsoft","The official Twitter page for Microsoft consumer products and your source for major announcements and events.","brand",NA,49164
"AppleMusic","Apple Music","All the ways you love music. All in one place.","brand",NA,27073
"AppStore","App Store","","brand",NA,25701
"AnupamPkher","Anupam Kher","Actor/Teacher/Author/Motivational Speaker/@UN_Women Champion of Gender Equality @HeForShe","person",NA,29762
"OMGFacts","OMG Facts","#TheMoreYouKnow","channel",NA,20110
"armani","Armani","https://t.co/DPsTDtdQXH","brand",NA,21771
"USAirways","US Airways","","airline",NA,34104
"Citilink","Citilink Indonesia","Welcome to the official Citilink Indonesia Twitter account! For more information & flight info, please call 08041080808 (24 Hours) / info@citilink.co.id","airline",NA,20417
"bhogleharsha","Harsha Bhogle","Blessed. Enjoy till it lasts.   https://t.co/AliHlEWvlX","person",NA,19782
"rihanna","Rihanna","Get #ANTI now: https://t.co/WH1Yy1ELJB","person",NA,73459
"Citi","Citi","Serving as a trusted partner to our clients by responsibly providing financial services that enable growth & economic progress. Customer service: @AskCiti","brand",NA,23803
"Asli_Jacqueline","Jacqueline Fernandez","Actress","person",NA,25974
"Louis_Tomlinson","Louis Tomlinson","1/4 of One Direction :) We would be nowhere without our incredible fans, we owe it all to you.","",NA,19265
"thesushmitasen","sushmita sen","I AM","person",NA,22416
"edsheeran","Ed Sheeran","x","person",NA,21703
"JLo","Jennifer Lopez","New Single #LoveMakeTheWorldGoRound out Now! #ShadesOfBlue On NBC, https://t.co/Vr9yBT9OHp","person",NA,51125
"dolcegabbana","Dolce & Gabbana","","brand",NA,22655
"ShaneWarne","Shane Warne","A proud father to 3 wonderful teenagers. Played cricket. Now cricket commentary. Cricket All Stars owner. Poker player & lover of 80's music. Single/Australian","person",NA,22632
"juniorbachchan","Abhishek Bachchan","Actor, sports fan.... Yup, that's about it.","person",NA,34271
"MirzaSania","Sania Mirza","Dreamer.Believer.Doer. Even against all odds./ @UN_Women Goodwill Ambassador for South Asia","person",NA,23897
"SkyNewsBreak","Sky News Newsdesk","The latest breaking news, direct from the Sky News team. Tweet @skynews with any questions or queries.","news",NA,17655
"guardian","The Guardian","Top stories, special features, live blogs and more","news",NA,46790
"BentleyMotors","Bentley Motors","Welcome to the official Twitter feed for Bentley Motors. The closer you look, the more you see. #BeExtraordinary","brand",NA,18859
"aamir_khan","Aamir Khan","Actor.","person",NA,45832
"ActuallyNPH","Neil Patrick Harris","I dig variety acts, Pixar, puppets, prestidigitation, immersive theatre, game shows, theme parks, my family and great meals. Not necessarily in that order.","person",NA,39166
"andresiniesta8","Andres Iniesta","FC Barcelona player. 
Born in Fuentealbilla 11 May 1984","person",NA,19365
"HungryGoWhere","HungryGoWhere","First stop for the Hungry. Singapore's best food & restaurants, promos & latest reviews - by the community, for the community. We help each other w/ what to eat","brand",NA,26308
"Forbes","Forbes","Official Twitter account of http://t.co/iVGiXAHX, homepage for the world's business leaders.","channel",NA,56368
"speishi","Peishi Soh"," Instagram: @speishi àû https://t.co/bJzgoclHvz àû Email me at speishi@hotmail.com","person",NA,31529
"jessicaalba","Jessica Alba","Mom of 2, Founder of The Honest Company, amateur chef, terrible speller, loyal friend, hilarious at times... I play make believe for a living","person",NA,22332
"MClarke23","Michael Clarke","","",NA,18216
"virendersehwag","Virender Sehwag","Indian Cricketer. For Endorsements, Events , Social Media Campaigns call Amritanshu +91 9873690935 ,For Sehwag International School call +91 9711188700","person",NA,24294
"geneliad","Genelia Deshmukh","","person",NA,21491
"harbhajan_singh","Harbhajan Turbanator","Proud father to a princess, Indian Cricketer. 
Facebook: https://t.co/t7La7Gcge7
Instagram: https://t.co/FfW5XFD3k8","person",NA,17591
"sonakshisinha","Sonakshi Sinha","Shotgun Junior! Instagram: aslisona, Snapchat: aslisonasnap","person",NA,31196
"UberFacts","UberFacts","The most unimportant things you'll never need to know.","channel",NA,33201
"FCBarcelona","FC Barcelona","More official accounts @fcbarcelona_cat @fcbarcelona_es @fcbarcelona_br @fcbarcelona_jp @fcbarcelona_id, @fcbarcelona_ara @fcbarcelona_fra @fcbarcelona_tr","sports",NA,26397
"FarOutAkhtar","Farhan Akhtar","Writer. Director. Actor. Singer/Songwriter. Founder- @MardOfficial Initiative | @UN_Women Goodwill Ambassador(South Asia)","person",NA,31844
"BrunoMars","Bruno Mars","","person",NA,30602
"iamsrk","Shah Rukh Khan","","person",NA,49833
"deepikapadukone","Deepika Padukone","Live,Love,Laugh... https://t.co/W632g3qOKi","person",NA,42782
"Alitalia","Alitalia","Welcome to the official AlitaliaTwitter account! Follow us for latest news and events!","travel",NA,26968
"astonmartin","Aston Martin","The only official Twitter account of Aston Martin Lagonda. Tweets of Power, Beauty and Soul. #astonmartin","brand",NA,20331
"NargisFakhri","Nargis","Global Citizen","person",NA,18688
"NiallOfficial","Niall Horan","Listen to my debut single 'This Town' here: https://t.co/xOVnVyUXcK","person",NA,21399
"airfrance","Air France","#FranceisintheAir! Stay connected for our latest news! At your service 24/7 (Personal info by DM only)","airline",NA,71612
"DubaiAirports","Dubai Airports","Dubai Airports owns and manages the operation of Dubai International (DXB) and Dubai World Central (DWC). ÿ™ÿßÿ®ÿπŸàÿß ÿµŸÅÿ≠ÿ™ŸÜÿß ÿ®ÿßŸÑŸÑÿ∫ÿ© ÿßŸÑÿπÿ±ÿ®Ÿäÿ© @DubaiAirportsAr","airport",NA,20130
"bipsluvurself","Bipasha Basu","An Actor & fitness enthusiast who believes in the philosophy of ''Love Yourself... Watch this space for the real me.","person",NA,25658
"SkySportsNewsHQ","Sky Sports News HQ","The official Twitter account for Sky Sports News HQ. Your home of sports news.","sports",NA,19516
"rampalarjun","arjun rampal","To touch is to heal. To hurt is to steal. Let's heal.","person",NA,21661
"SunidhiChauhan5","Sunidhi Chauhan","Singer, performer","person",NA,17475
"ImZaheer","zaheer khan","Cricketer | Fitness Enthusiast | Owner of ProSport Fitness| Co-Owner of Toss, Dine Fine| Cheese Cake Lover| Playing for DD in IPL8 | Love Mumbai|","person",NA,19039
"kimberly_chia","Kimberly Chia","A blessed girl having the time of her life. Learning to appreciate everything that is life.  kimberlychia.sg","person",NA,31706
"bomanirani","Boman Irani","work in progress","person",NA,23052
"AirAsiaId","AirAsia Indonesia","Maskapai penerbangan berbiaya hemat dan inovatif. 
untuk segala pertanyaan/complaint silakan langsung mention @askairasia","airline",NA,35158
