"screen_name","name","description","category","X","count"
"iHrithik","Hrithik Roshan","Man on mission- to live the best life possible come what may.","person",NA,40524
"SoSingaporean","So Singaporean","Follow to discover everything so unique and #sosingaporean! For any enquiries and adverts kindly contact me at: sosingaporean.twitter@gmail.com","person",NA,69898
"ThaiAirways","Thai Airways","Welcome aboard to official Twitter account of Thai Airways International","airline",NA,20042
"basuki_btp","Ahok Basuki TPurnama","SMS pengaduan : 0811944728, 081927666999, 085811291966 (sms ke satu nomer saja sesuai kartu yang dipakai agar lebih murah) sekretariat.gubdki@gmail.com","person",NA,18016
"TheShilpaShetty","SHILPA SHETTY KUNDRA","Full time Mother & Wife,part time Actor, Author of @greatindiandiet ,Yoga enthusiast Entrepreneur ,Founder of @Iosis Spa&Salons, @viaanmobiles & @SSFCare my NGO","person",NA,24222
"ConanOBrien","Conan O'Brien","The voice of the people. Sorry, people.","person",NA,38537
"YahooSG","Yahoo Singapore","Yahoo Singapore's official Twitter account. For bite-sized news and thoughts from S'pore and the world. https://t.co/8THI4Qh1GQ | http://t.co/g43c7Fwh4F","news",NA,74700
"LilTunechi","Lil Wayne WEEZY F","IM YOUNG MONEY http://t.co/wMwkyzCu","person",NA,31644
"NatGeoPhotos","Nat Geo Photography","All things photography from National Geographic. Like us on Facebook: https://t.co/17NiJ0092Z","",NA,26891
"_austrian","Austrian Airlines","Official Austrian Airlines twitter Channel - the charming way to fly! For compliments and complaints, please refer to https://t.co/ODtoNtlX4z.","airline",NA,28848
"ImRaina","Suresh Raina","Cricket is my Passion, Fans are my Strength and Family is my Support","person",NA,25088
"ImRo45","Rohit Sharma","","person",NA,20216
"Javedakhtarjadu","Javed Akhtar","A poet, lyricist, scriptwriter, atheist and a die-hard optimist","person",NA,18990
"lufthansa","Lufthansa","Welcome to the official twitter channel (international) of Deutsche Lufthansa AG!","airline",NA,96488
"TheVijayMallya","Vijay Mallya","Former Member of Parliament, India, Chairman, The UB Group, Co-owner & Team Principal Sahara Force India Formula 1","person",NA,24588
"smritiirani","Smriti Z Irani","Union Cabinet Minister of Textiles, Government of India. Member of Parliament, Rajya Sabha representing the state of Gujarat.","person",NA,21894
"twittermedia","Twitter Media","Discover the best content on Twitter, across news, sports, entertainment, politics, music, and lifestyle.","channel",NA,21483
"donghae861015","Super Junior Ïù¥ÎèôÌï¥","SJ","person",NA,26666
"BeingSalmanKhan","Salman Khan","Film actor, artist, painter, humanitarian","person",NA,44534
"LeoDiCaprio","Leonardo DiCaprio","Actor and Environmentalist","person",NA,41579
"flightradar24","Flightradar24","Track air traffic in real time from all around the world! Apps: http://t.co/ongfnAPfLz
FAQ: http://t.co/WfQImBHLYe
Support: http://t.co/ifn4x04sH9","travel",NA,19189
"timesofindia","Times of India","News. Views. Analyses. Conversations. India's No.1 digital news destination, world's largest-selling English newspaper.","news",NA,32040
"sachin_rt","sachin tendulkar","Proud Indian","person",NA,34043
"voguemagazine","Vogue Magazine","The official twitter page of Vogue Magazine.","channel",NA,31364
"FIFAWorldCup","FIFA World Cup","Updates for Russia 2018 provided by the Official Site of the FIFA World Cup","sports",NA,23946
"ABdeVilliers17","AB de Villiers","Professional Cricket player
Proudly South African","person",NA,22055
"FIFAcom","FIFA.com","Bringing you interviews, features and news on FIFA and our 211 Member Associations. https://t.co/Qgt2IiVKey","sports",NA,32724
"SrBachchan","Amitabh Bachchan","Actor ... well at least some are STILL saying so !!","person",NA,48955
"STPix","Straits Times Photo","The Straits Times Photo Desk See news pictures, photo essays, and multimedia stories produced by our photojournalists at http://t.co/eGknlnhg8t","news",NA,18473
"dhanushkraja","Dhanush","Actor","person",NA,17441
"mangeshkarlata","Lata Mangeshkar","playback singer since 1942. https://t.co/8BRJP3bvMX","person",NA,20448
"IndonesiaGaruda","Garuda Indonesia","The Airline Of Indonesia | 24 hours Call Center 08041807807, +622123519999 | sosialmedia@garuda-indonesia.com |Facebook https://t.co/c2c2QMoNGf","airline",NA,34651
"Cristiano","Cristiano Ronaldo","This Privacy Policy addresses the collection and use of personal information - https://t.co/Jp6yh1T58c","person",NA,55359
"rioferdy5","Rio Ferdinand","Official Twitter account of Rio Ferdinand / Media Enquiries - info@neweraglobalsports.com / https://t.co/9hI5ihb0LY / SC - rioferdyfive","person",NA,19746
"KendallJenner","Kendall","Model - The Society Management // Elite Paris // Elite London // Elite Milan","person",NA,36951
"LiamPayne","Liam","the luckiest man in the world","person",NA,19625
"neymarjr","Neymar Jr","Filho de Deus, Pai, Feliz e Ousado !","person",NA,27243
"DeltaNewsHub","Delta News Hub","Official Twitter newsroom of Delta Air Lines, a resource for people sharing Delta news. Visit @Delta for customer service, tips and promos.","airline",NA,18710
"EmWatson","Emma Watson","Actor & @UN_Women Global Goodwill Ambassador.                                Facebook: EmmaWatson Instagram: EmmaWatson Goodreads: OurSharedShelf","person",NA,46490
"DaleSteyn62","Dale Steyn","Terrible guitar player...","person",NA,17434
"kanyewest","KANYE WEST","","person",NA,33847
"KP24","KP","","person",NA,20557
"BBC_Travel","BBC Travel","Discover new cultures. Embark on new adventures. Celebrate. Explore. Engage. BBC Travel: Inspiring you to fall in love with the world.","travel",NA,33228
"Realtaeyang","TAEYANG","","person",NA,18555
"zaynmalik","zayn","fuck whoever tells you no ! do you, be proud and love lots ! :) https://t.co/Qzd4N5khhM","person",NA,18010
"ICC","ICC","The official twitter account of the International Cricket Council, world cricket's governing body #CT17 Starts June 1st 2017","other",NA,23161
"instagram","Instagram","Discovering Äî and telling Äî stories from around the world. Curated by Instagram's community team. Need help? Visit https://t.co/OQR3Kbbcdw.","channel",NA,55920
"Harry_Styles","Harry Styles.","Raconteur.  https://t.co/gtTGAbq5KP","person",NA,26253
"aliaa08","Alia Bhatt","Beautifully chaotic :)","person",NA,32833
"XabiAlonso","Xabi Alonso","Cuenta oficial de Xabi Alonso","",NA,19676
"Adele","Adele","https://t.co/5Vf55N5xFe","person",NA,38452
"BCCI","BCCI","The Official Twitter Handle of Team India","sports",NA,19006
"victoriabeckham","Victoria Beckham","The Official Twitter page for Victoria Beckham","person",NA,26112
"TheFarahKhan","Farah Khan","Film Director, Choreographer, Producer, now Actress & proud Mother of Triplets.","person",NA,22477
"YouTubeTrends","YouTube Trends","","other",NA,18208
"onedirection","One Direction","1D's album Made in the A.M. is OUT NOW: https://t.co/gtTGAb8uTh |","person",NA,31784
"LewisHamilton","Lewis Hamilton","H.A.M til the day I die!! #TeamLH Snapchat: lewishamilton https://t.co/Q4FiC7dSrt
https://t.co/A341DuifUN https://t.co/DYC80EzVtG","person",NA,19872
"Qantas","Qantas","The official Qantas Twitter page to share information & get feedback. We're online 24 hours a day, 7 days a week.","airline",NA,107851
"SushmaSwaraj","Sushma Swaraj","Minister of External affairs","person",NA,23050
"3gerardpique","Gerard Pique","FCBarcelona | Football Player","person",NA,19931
"redbullracing","Red Bull Racing","#GivesYouWings #PushTheBoundaries","brand",NA,19945
"iam_juhi","Juhi Chawla","Actress, Mother, Entrepreneur, Activist, budding Organic Farmer, Environmentalist, Yoga enthusiast.... aur abhi  picture Baaki Hai ..... ","news",NA,17431
"Zongino","Zongino","OUT OF THIS WORLD FUN","",NA,28298
"Persie_Official","Robin van Persie","@Fenerbahce","",NA,22123
"KylieJenner","Kylie Jenner","https://t.co/xpTyiQavPr https://t.co/ExGKy1KFmO","person",NA,34903
"thejianhaotan","JianHao F≤ Tan","To catch me, you gotta be fast. To find me, you gotta be smart. To be me... lol, you gotta be kidding. https://t.co/jivUlIUvfu","person",NA,27706
"TimesNow","TIMES NOW","Times Now is India's most watched English news channel. Follow us for breaking news & updates.","news",NA,24189
"GooglePlay","Google Play","We're exploring the world's greatest stories through movies, TV, music, games, apps, books and so much more. Up for new adventures and discoveries? Let's play.","brand",NA,38637
"TheRock","Dwayne Johnson","Chivalrous gentleman.","person",NA,20364
"DjokerNole","Novak Djokovic","Laugh as long as you breathe, love as long as you live!","person",NA,24162
"united","United","Conversations with you here are 140 characters-friendly. Tweet us any time. For a formal response visit https://t.co/cpgjUnDsve.","airline",NA,82444
"imMichelleChong","Michelle Chong","Are you ready for LULU THE MOVIE?! https://t.co/neIGgEt1Bb","person",NA,20834
"BBCSport","BBC Sport","Official https://t.co/XsBH2P4slh account. Also from @bbc - @bbcmotd @bbcf1 @bbctms @bbctennis @bbcrugbyunion & @bbcgetinspired","sports",NA,32092
"MileyCyrus","Miley Ray Cyrus","Miley Cyrus & Her Dead Petz out now fo freeeeeee mothaaaa fuckazzz!","person",NA,36431
"xtina","Christina Aguilera","","person",NA,28561
"RNTata2000","Ratan N. Tata","Former Chairman of Tata Group. Personal interests : - aviation, automobiles, scuba diving and architectural design.","person",NA,28908
"WayneRooney","Wayne Rooney","@NikeUK athlete https://t.co/3yp07llC6E @triplessports","person",NA,31385
"MariaSharapova","Maria Sharapova","https://t.co/NaE11fCnqd","person",NA,18460
"SamsungMobile","Samsung Mobile","[Statement] Samsung Urges Galaxy Note7 Users to Immediately Participate in The Replacement Program https://t.co/qyBpeBPd64","brand",NA,60908
"adidas","adidas","","sports",NA,19119
"TwitterSports","Twitter Sports","Official Account run by the Global Sports Team @Twitter.","sports",NA,22648
"PDChina","People's Daily,China","The largest newspaper group in China; Timely updates 
https://t.co/GjIOtXvfA2 https://t.co/nCvfm8gTgr","news",NA,23307
"SMRT_Singapore","SMRT Corporation","Official Twitter channel for SMRT. Offers information and real-time train service updates. For feedback, drop a line to http://t.co/G2rbdPLYAu","other",NA,68858
"ShraddhaKapoor","Shraddha Kapoor","Living the dream!","person",NA,24373
"Maserati_HQ","Maserati","Elegance, style, sportiness and performance with a long and glorious heritage. #Maserati, a tradition of innovation. https://t.co/4y3AGiONQE","brand",NA,17377
"Lamborghini","Lamborghini","Visionary | Cutting Edge | Pure Super Sports Car Maker. #Lamborghini","brand",NA,23978
"CHANEL","CHANEL","'CHANEL is above all a style. Fashion passes, style remains.' Gabrielle Chanel","brand",NA,29295
"Pharrell","Pharrell Williams","@i_am_OTHER","person",NA,19408
"premierleague","Premier League","Official Twitter account of the Premier League. The official Premier League app is now LIVE and FREE to download https://t.co/2wlDwf7gu1","sports",NA,57033
"RafaelNadal","Rafa Nadal","Tennis player.","person",NA,26457
"Dior","Dior","","brand",NA,29290
"Jaguar","Jaguar","Official Jaguar worldwide Twitter account for news, videos and photos from Jaguar cars, home to #FTYPE, #XE, #XF, #XJ and #FPACE.","brand",NA,19485
"WhatTheFFacts","What The F*** Facts","All (& only) things that make you say WTF. Official Account of What The F*** Facts.","channel",NA,39570
"hmsingapore","H&M Singapore","Fashion and quality at the best price.","brand",NA,26743
"Varun_dvn","Varun dhawan","artist, the voice of the voiceless","person",NA,19855
"jokowi","Joko Widodo","Akun resmi Joko Widodo, Presiden Republik Indonesia","person",NA,19330
"TwitterMusic","Twitter Music","Music related Tweets from around the world.","brand",NA,23421
"3M","3M","Here, we innovate with purpose & use #science every day to create real impact in every life around the world. #Lifewith3M","brand",NA,22778
"Android","Android","News, tips, and tricks direct from the Android team.","brand",NA,50602
"ArvindKejriwal","Arvind Kejriwal","Political revolution in India has begun. Bharat jaldi badlega. Arvind Kejriwal.","person",NA,28375
"BrettLee_58","Brett Lee","Former Cricketer now commentator","person",NA,18124
"SimonCowell","Simon Cowell","","",NA,18380
"Nike","Nike","#justdoit","brand",NA,25510
"smrtsg","SMRT Feedback","Singapore's Social Media Badass.","person",NA,35083
"PMOIndia","PMO India","Office of the Prime Minister of India","person",NA,40810
"XHNews","China Xinhua News","China Insight, Global View. Xinhua News Agency is the first port of call for the latest China and world news. https://t.co/U0WI8N4Fll https://t.co/IHLImeWM1V","news",NA,47714
"ZacEfron","Zac Efron","","person",NA,17838
"Pontifex","Pope Francis","Welcome to the official Twitter page of His Holiness Pope Francis","person",NA,25691
"TrulyNoah","Noah Yap Âè∂Ëç£ËÄÄ","Actor - Host - YouTuber Business enquiries: nyry-.-@hotmail.com","person",NA,30206
"MesutOzil1088","Mesut √ñzil","Football player for @arsenal & @DFB_Team","person",NA,23056
"ManUtd","Manchester United","Official account of Manchester United FC Ô∏è","person",NA,47635
"vine","Vine","Vine is an entertainment community where things happen fast. Sign up for #beyondtheVine at the link below!","channel",NA,18652
"SGAG_SG","Mr. SGAG","Your daily dose of Singaporean humor.
http://t.co/9O4olF8kpf","channel",NA,60067
"ChampionsLeague","Champions League","The official home of the UEFA Champions League on Twitter.     Spanish account: @LigadeCampeones U19: @UEFAYouthLeague","sports",NA,36056
"IBGDRGN","G-DRAGON","ñí ONE AND ONLY GD ñí http://t.co/94cfAZzmy9ÔΩúhttp://t.co/YepKJotLhAÔΩúhttp://t.co/z4O2zgQL5qÔΩúinstagram:XXXIBGDRGN | http://t.co/Txk7haRyAV","person",NA,37378
"psy_oppa","PSY","#7thALBUM on iTunes https://t.co/9oXqUb7l9M #DADDY M/V on YouTube https://t.co/3SgevEYdt4 #NapalBaji M/V on YouTube https://t.co/3gLItsxkW0","person",NA,20388
"GarethBale11","Gareth Bale","Footballer. @realmadrid and @FAWales. Instagram - https://t.co/nWn3lae5ky","person",NA,21845
"EuropaLeague","UEFA Europa League","The official home of the UEFA Europa League on Twitter. #UEL","sports",NA,18885
"emirates","Emirates airline","The official Twitter channel for Emirates airline. Pls tweet @EmiratesSupport if you need any assistance in English & Arabic. We are online 24/7","airline",NA,159046
"krungy21","Sandara Park","Ìà¨Ïï†ÎãàÏõêÏùò ÏÉÅÌÅºÌïúÎ≥¥Ïª¨ & Ïã†Ïù∏Ïó¨Î∞∞Ïö∞ 2NE1's fresh vocal & Pambansang krungkrung ng Pilipinas & Actress","person",NA,19014
"S1dharthM","Sidharth Malhotra","keep it real","person",NA,20840
"kobebryant","Kobe Bryant","CEO Kobe Inc. Publisher. Investor. Producer.","person",NA,18783
"FLOTUS","The First Lady","This account is run by the Office of First Lady Michelle Obama. Tweets from the First Lady are signed -mo. Tweets may be archived. More at https://t.co/eVVzoBb3Zr","person",NA,25685
"superstarrajini","Rajinikanth","The official handle of Superstar Rajinikanth","news",NA,19293
"TheDeeKosh","Dee Kosh","i talk on the radio @Power98. I talk on YouTube. In a loving long term relationship with Fried Chicken Contact : deekosh@gmail.com","person",NA,37611
"SBYudhoyono","S. B. Yudhoyono","Akun Resmi Presiden Ke-6 RI (2004-2014) Susilo Bambang Yudhoyono. Dikelola oleh Staf Pribadi. Twit dari Susilo Bambang Yudhoyono ditandai *SBY*","person",NA,20000
"billclinton","Bill Clinton","Founder, Clinton Foundation and 42nd President of the United States. Follow @clintonfdn fo more on my work around the world.","person",NA,34723
"rogerfederer","Roger Federer","Professional tennis player","person",NA,26925
"HillaryClinton","Hillary Clinton","Wife, mom, grandma, women+kids advocate, FLOTUS, Senator, SecState, hair icon, pantsuit aficionado, 2016 presidential candidate. Tweets from Hillary signed -H","person",NA,41569
"rajnathsingh","Rajnath Singh","Minister of Home Affairs, Government of India, INDIA","other",NA,18972
"KapilSharmaK9","KAPIL","Actor...who loves to make ppl laugh... ..https://t.co/lvWDr75m4z","person",NA,22594
"our_sg","Our SG","Our Singapore Spirit is kindling. Let us use it as a torch to illuminate the way forward, whilst we turn the page to a new chapter.","other",NA,17636
"POTUS","President Obama","Dad, husband, and 44th President of the United States. Tweets may be archived: http://t.co/eVVzoATsAR.","person",NA,42300
"Ryanair","Ryanair","Thanks for choosing Europe's favourite airline! We're here 7am - 9pm everyday. Ryanair. Low Fares. Made Simple. Live Flight Info here: https://t.co/cnePB7yLGg","airline",NA,23232
"BMW","BMW","Welcome to the official #BMW account. http://t.co/VjgKsKkFhI","brand",NA,22878
"tim_cook","Tim Cook","CEO Apple, Fan of Auburn football and Duke basketball","news",NA,18938
"arunjaitley","Arun Jaitley","Minister of Finance & Corporate Affairs, Government of India","person",NA,24512
"arjunk26","Arjun Kapoor","Son, Brother, Friend, Actor ( all 4 work in progress)","person",NA,19556
